GeoFIPS,GeoName,Region,TableName,LineCode,IndustryClassification,Description,Unit,2001,2002,2003,2004,2005,2006,2007,2008,2009,2010,2011,2012,2013,2014,2015,2016,2017,2018
 "11001","District of Columbia, DC",2,CAGDP1,1,"...","Real GDP (thousands of chained 2012 dollars)","Thousands of chained 2012 dollars",88505786,91195356,93024972,97797779,99954650,100242100,102956464,106746788,106351317,109964063,112008296,112736453,112677868,114910467,117238433,119567337,121011225,123981627
 "11001","District of Columbia, DC",2,CAGDP1,2,"...","Chain-type quantity indexes for real GDP","Quantity index",78.507,80.893,82.515,86.749,88.662,88.917,91.325,94.687,94.336,97.541,99.354,100.000,99.948,101.928,103.993,106.059,107.340,109.975
 "11001","District of Columbia, DC",2,CAGDP1,3,"...","Current-dollar GDP (thousands of current dollars)","Thousands of dollars",65565895,70054726,74090314,80471283,85304876,88517171,93969975,99478479,100894609,106120332,110076194,112736453,114890972,119840996,125211871,129826050,134042685,140660945
"Note: See the included footnote file."
"CAGDP1: Gross Domestic Product (GDP) summary by county and metropolitan area "
"Last updated: December 12, 2019 -- new statistics for 2001-2018. "
"Source: U.S. Department of Commerce / Bureau of Economic Analysis / Regional Economic Accounts"
